<?xml version="1.0" encoding="UTF-8"?>
<simulation xmlns="http://www.bidib.org/jbidibc/simulation/nodes" xmlns:xsi="http://www.w3.org/2001/XMLSchema-instance" xsi:schemaLocation="http://www.bidib.org/jbidibc/simulation/nodes /xsd/simulation.xsd">
    <master uniqueId="d2000d680064ea" className="org.bidib.jbidibc.simulation.nodes.Master" address="0">
        <subNodes>
            <node uniqueId="05340d6B901234" className="org.bidib.jbidibc.simulation.nodes.Node" address="1" productName="Product1" userName="My username">
                <LPORT count="32"/>
                <SPORT count="8"/>
            </node>
            <node uniqueId="05343e97901235" className="org.bidib.jbidibc.simulation.nodes.Node" address="2" autoAddFeature="true">
                <SPORT count="8"/>
            </node>
            <node xsi:type="HubType" uniqueId="05343e97901236" className="org.bidib.jbidibc.simulation.nodes.Node" address="2">
                <INPUT count="8"/>
                <subNodes>
                    <node uniqueId="05343e97901237" className="org.bidib.jbidibc.simulation.nodes.Node" address="1">
                        <SPORT count="16"/>
                    </node>
                </subNodes>
            </node>
        </subNodes>
    </master>
</simulation>
